{"$schema": "http://json-schema.org/draft-07/schema#", "$id": "https://full-video-pipeline/animations/bar-code-scan.schema.json", "title": "BarCodeScan instance", "type": "object", "additionalProperties": false, "required": ["extras"], "properties": {"$schema": {"type": "string"}, "instanceId": {"type": "string"}, "theme": {"$ref": "https://full-video-pipeline/schemas/animations.schema.json#/definitions/theme"}, "global": {"$ref": "https://full-video-pipeline/schemas/animations.schema.json#/definitions/global"}, "elements": {"type": "array", "items": {"type": "object", "additionalProperties": true, "required": ["id"], "properties": {"id": {"type": "string", "pattern": "^bar-[0-9]+$"}, "text": {"type": ["string", "null"]}, "delay": {"type": ["number", "null"], "minimum": 0, "maximum": 60000}, "duration": {"type": ["number", "null"], "minimum": 1, "maximum": 60000}, "easing": {"$ref": "https://full-video-pipeline/schemas/animations.schema.json#/definitions/easingName"}, "position": {"$ref": "https://full-video-pipeline/schemas/animations.schema.json#/definitions/element/properties/position"}, "size": {"type": "object", "additionalProperties": false, "properties": {"fontSize": {"type": ["number", "null"], "minimum": 4, "maximum": 1000}, "scale": {"type": ["number", "null"], "minimum": 0.05, "maximum": 20}}}, "color": {"$ref": "https://full-video-pipeline/schemas/animations.schema.json#/definitions/element/properties/color"}, "hidden": {"type": "boolean", "default": false}, "custom": {"type": "object", "additionalProperties": true, "properties": {"value": {"type": "number"}, "width": {"type": "number", "minimum": 0.05, "maximum": 4}}}}}}, "extras": {"type": "object", "additionalProperties": false, "required": ["barcodeBars"], "properties": {"barcodeBars": {"type": "array", "items": {"type": "string"}, "minItems": 1, "maxItems": 12}, "scanStartSeconds": {"type": "number", "minimum": 0, "maximum": 10, "default": 0.5}, "scanLineSeconds": {"type": "number", "minimum": 0.4, "maximum": 8, "default": 2.5}, "scanEasing": {"$ref": "https://full-video-pipeline/schemas/animations.schema.json#/definitions/easingName"}, "scanWidthPx": {"type": "number", "minimum": 1, "maximum": 6, "default": 3}, "scanColor": {"type": ["string", "null"], "default": null}, "scanGlow": {"type": "boolean", "default": true}, "barcodeHeightPct": {"type": "number", "minimum": 10, "maximum": 80, "default": 45}, "barcodeWidthPct": {"type": "number", "minimum": 30, "maximum": 100, "default": 80}, "barBaseWidthPx": {"type": "number", "minimum": 4, "maximum": 64, "default": 24}, "barGapPx": {"type": "number", "minimum": 0, "maximum": 80, "default": 16}, "idleColor": {"type": ["string", "null"], "default": null}, "decodedColor": {"type": ["string", "null"], "default": null}, "countUp": {"type": "boolean", "default": true}, "valueFormat": {"type": "string", "enum": ["int", "decimals1", "decimals2", "percent"], "default": "int"}, "valueFontPx": {"type": "number", "minimum": 8, "maximum": 120, "default": 32}, "labelFontPx": {"type": "number", "minimum": 8, "maximum": 80, "default": 22}, "showValueLabels": {"type": "boolean", "default": true}, "showSpineTicks": {"type": "boolean", "default": true}, "valueLabelColor": {"type": ["string", "null"], "default": null}, "holdAfterScanFrames": {"type": "integer", "minimum": 0, "maximum": 600, "default": 30}}}}}
