{"instanceId": "bar-code-scan.defaults", "theme": {}, "global": {"speed": 1, "delayOffset": 0, "easing": "ease-out-cubic"}, "elements": [{ "id": "bar-0", "text": "A" }], "extras": {"barcodeBars": ["A", "B", "C", "D", "E"], "scanStartSeconds": 0.5, "scanLineSeconds": 2.5, "scanEasing": "ease-in-out", "scanWidthPx": 3, "scanColor": null, "scanGlow": true, "barcodeHeightPct": 45, "barcodeWidthPct": 80, "barBaseWidthPx": 24, "barGapPx": 16, "idleColor": null, "decodedColor": null, "countUp": true, "valueFormat": "int", "valueFontPx": 32, "labelFontPx": 22, "showValueLabels": true, "showSpineTicks": true, "valueLabelColor": null, "holdAfterScanFrames": 30}}